# Source file, Gloss output file, title
jiutangshu/jiutangshu000i.txt	jiutangshu/jiutangshu000i.html	Introduction
jiutangshu/jiutangshu001.txt	jiutangshu/jiutangshu001.html	卷一   本紀第一:  高祖 Volume 1 Annals 1: Gaozu
jiutangshu/jiutangshu002.txt	jiutangshu/jiutangshu002.html	卷二   本紀第二:  太宗上 Volume 2 Annals 2: Taizong 1
jiutangshu/jiutangshu003.txt	jiutangshu/jiutangshu003.html	卷三   本紀第三:  太宗下 Volume 3 Annals 3: Taizong 2
jiutangshu/jiutangshu004.txt	jiutangshu/jiutangshu004.html	卷四   本紀第四:  高宗上 Volume 4 Annals 4: Gaozong 1
jiutangshu/jiutangshu005.txt	jiutangshu/jiutangshu005.html	卷五   本紀第五:  高宗下 Volume 5 Annals 5: Gaozong 2
jiutangshu/jiutangshu006.txt	jiutangshu/jiutangshu006.html	卷六   本紀第六:  則天皇后 Volume 6 Annals 6: Empress Wu Zetian
jiutangshu/jiutangshu007.txt	jiutangshu/jiutangshu007.html	卷七   本紀第七:  中宗 睿宗 Volume 7 Annals 7: Zhongzong, Ruizong
jiutangshu/jiutangshu008.txt	jiutangshu/jiutangshu008.html	卷八   本紀第八:  玄宗上 Volume 8 Annals 8: Xuanzong 1
jiutangshu/jiutangshu009.txt	jiutangshu/jiutangshu009.html	卷九   本紀第九:  玄宗下 Volume 9 Annals 9: Xuanzong 2
jiutangshu/jiutangshu010.txt	jiutangshu/jiutangshu010.html	卷十  本紀第十:  肅宗 Volume 10 Annals 10: Suzong
jiutangshu/jiutangshu011.txt	jiutangshu/jiutangshu011.html	卷十一  本紀第十一:  代宗 Volume 11 Annals 11: Daizong
jiutangshu/jiutangshu012.txt	jiutangshu/jiutangshu012.html	卷十二  本紀第十二:  德宗上 Volume 12 Annals 12: Dezong 1
jiutangshu/jiutangshu013.txt	jiutangshu/jiutangshu013.html	卷十三  本紀第十三:  德宗下 Volume 13 Annals 13: Dezong 2
jiutangshu/jiutangshu014.txt	jiutangshu/jiutangshu014.html	卷十四  本紀第十四:  順宗 憲宗上 Volume 14 Annals 14: Shunzong, Xianzong 1
jiutangshu/jiutangshu015.txt	jiutangshu/jiutangshu015.html	卷十五  本紀第十五:  憲宗下 Volume 15 Annals 15: Xianzong 2
jiutangshu/jiutangshu016.txt	jiutangshu/jiutangshu016.html	卷十六  本紀第十六:  穆宗 Volume 16 Annals 16: Muzong
jiutangshu/jiutangshu017.txt	jiutangshu/jiutangshu017.html	卷十七上 本紀第十七上: 敬宗 文宗上 Volume 17 Annals 17: Jingzong, Wenzong 1
jiutangshu/jiutangshu018.txt	jiutangshu/jiutangshu018.html	卷十七下 本紀第十七下: 文宗下 Volume 17 Annals 17: Wenzong 2
jiutangshu/jiutangshu019.txt	jiutangshu/jiutangshu019.html	卷十八上 本紀第十八上: 武宗 Volume 18 Annals 18: Wuzong
jiutangshu/jiutangshu020.txt	jiutangshu/jiutangshu020.html	卷十八下 本紀第十八下: 宣宗 Volume 18 Annals 18: Xuanzong
jiutangshu/jiutangshu021.txt	jiutangshu/jiutangshu021.html	卷十九上 本紀第十九上: 懿宗 Volume 19 Annals 19: Yizong
jiutangshu/jiutangshu022.txt	jiutangshu/jiutangshu022.html	卷十九下 本紀第十九下: 僖宗 Volume 19 Annals 19: Xizong
jiutangshu/jiutangshu023.txt	jiutangshu/jiutangshu023.html	卷二十上 本紀第二十上: 昭宗 Volume 20 Annals 20: Zhaozong
jiutangshu/jiutangshu024.txt	jiutangshu/jiutangshu024.html	卷二十下 本紀第二十下: 哀帝 Volume 20 Annals 20: Emperor Ai
jiutangshu/jiutangshu025.txt	jiutangshu/jiutangshu025.html	卷二十一 志第一: 禮儀一 Volume 21 Treatises 1: Rites 1
jiutangshu/jiutangshu026.txt	jiutangshu/jiutangshu026.html	卷二十二 志第二: 禮儀二 Volume 22 Treatises 2: Rites 2
jiutangshu/jiutangshu027.txt	jiutangshu/jiutangshu027.html	卷二十三 志第三: 禮儀三 Volume 23 Treatises 3: Rites 3
jiutangshu/jiutangshu028.txt	jiutangshu/jiutangshu028.html	卷二十四 志第四: 禮儀四 Volume 24 Treatises 4: Rites 4
jiutangshu/jiutangshu029.txt	jiutangshu/jiutangshu029.html	卷二十五 志第五: 禮儀五 Volume 25 Treatises 5: Rites 5
jiutangshu/jiutangshu030.txt	jiutangshu/jiutangshu030.html	卷二十六 志第六: 禮儀六 Volume 26 Treatises 6: Rites 6
jiutangshu/jiutangshu031.txt	jiutangshu/jiutangshu031.html	卷二十七 志第七: 禮儀七 Volume 27 Treatises 7: Rites 7
jiutangshu/jiutangshu032.txt	jiutangshu/jiutangshu032.html	卷二十八 志第八: 音樂一 Volume 28 Treatises 8: Music 1
jiutangshu/jiutangshu033.txt	jiutangshu/jiutangshu033.html	卷二十九 志第九: 音樂二 Volume 29 Treatises 9: Music 2
jiutangshu/jiutangshu034.txt	jiutangshu/jiutangshu034.html	卷三十  志第十: 音樂三 Volume 30 Treatises 10: Music 3
jiutangshu/jiutangshu035.txt	jiutangshu/jiutangshu035.html	卷三十一 志第十一: 音樂四 Volume 31 Treatises 11: Music 4
jiutangshu/jiutangshu036.txt	jiutangshu/jiutangshu036.html	卷三十二 志第十二: 曆一 Volume 32 Treatises 12: Calendar 1
jiutangshu/jiutangshu037.txt	jiutangshu/jiutangshu037.html	卷三十三 志第十三: 曆二 Volume 33 Treatises 13: Calendar 2
jiutangshu/jiutangshu038.txt	jiutangshu/jiutangshu038.html	卷三十四 志第十四: 曆三 Volume 34 Treatises 14: Calendar 3
jiutangshu/jiutangshu039.txt	jiutangshu/jiutangshu039.html	卷三十五 志第十五: 天文上 Volume 35 Treatises 15: Astronomy 1
jiutangshu/jiutangshu040.txt	jiutangshu/jiutangshu040.html	卷三十六 志第十六: 天文下 Volume 36 Treatises 16: Astronomy 2
jiutangshu/jiutangshu041.txt	jiutangshu/jiutangshu041.html	卷三十七 志第十七: 五行 Volume 37 Treatises 17: Five Elements
jiutangshu/jiutangshu042.txt	jiutangshu/jiutangshu042.html	卷三十八 志第十八: 地理一 Volume 38 Treatises 18: Geography 1
jiutangshu/jiutangshu043.txt	jiutangshu/jiutangshu043.html	卷三十九 志第十九: 地理二 Volume 39 Treatises 19: Geography 2
jiutangshu/jiutangshu044.txt	jiutangshu/jiutangshu044.html	卷四十  志第二十: 地理三 Volume 40 Treatises 20: Geography 3
jiutangshu/jiutangshu045.txt	jiutangshu/jiutangshu045.html	卷四十一 志第二十一: 地理四 Volume 41 Treatises 21: Geography 4
jiutangshu/jiutangshu046.txt	jiutangshu/jiutangshu046.html	卷四十二 志第二十二: 職官一 Volume 42 Treatises 22: Government Service 1
jiutangshu/jiutangshu047.txt	jiutangshu/jiutangshu047.html	卷四十三 志第二十三: 職官二 Volume 43 Treatises 23: Government Service 2
jiutangshu/jiutangshu048.txt	jiutangshu/jiutangshu048.html	卷四十四 志第二十四: 職官三 Volume 44 Treatises 24: Government Service 3
jiutangshu/jiutangshu049.txt	jiutangshu/jiutangshu049.html	卷四十五 志第二十五: 輿服 Volume 45 Treatises 25: Carriages and Clothes
jiutangshu/jiutangshu050.txt	jiutangshu/jiutangshu050.html	卷四十六 志第二十六: 經籍上 Volume 46 Treatises 26: Literature 1
jiutangshu/jiutangshu051.txt	jiutangshu/jiutangshu051.html	卷四十七 志第二十七: 經籍下 Volume 47 Treatises 27: Literature 2
jiutangshu/jiutangshu052.txt	jiutangshu/jiutangshu052.html	卷四十八 志第二十八: 食貨上 Volume 48 Treatises 28: Finance and Economics 1
jiutangshu/jiutangshu053.txt	jiutangshu/jiutangshu053.html	卷四十九 志第二十九: 食貨下 Volume 49 Treatises 29: Finance and Economics 2
jiutangshu/jiutangshu054.txt	jiutangshu/jiutangshu054.html	卷五十  志第三十: 刑法 Volume 50 Treatises 30: Punishment and Law
jiutangshu/jiutangshu055.txt	jiutangshu/jiutangshu055.html	卷五十一 列傳第一: 后妃上 Volume 51 Biographies 1: Empresses and Consorts 1
jiutangshu/jiutangshu056.txt	jiutangshu/jiutangshu056.html	卷五十二 列傳第二: 后妃下 Volume 52 Biographies 2: Empresses and Consorts 2
jiutangshu/jiutangshu057.txt	jiutangshu/jiutangshu057.html	卷五十三 列傳第三: 李密 單雄信 Volume 53 Biographies 3: Li Mi, Dan Xiongxin
jiutangshu/jiutangshu058.txt	jiutangshu/jiutangshu058.html	卷五十四 列傳第四: 王世充 竇建德 Volume 54 Biographies 4: Wang Shicong, Dou Jiande
jiutangshu/jiutangshu059.txt	jiutangshu/jiutangshu059.html	卷五十五 列傳第五: 薛舉 李軌 劉武周 高開道 劉黑闥 Volume 55 Biographies 5: Xue Ju, Li Gui, Li Wuzhou,Gao Kaidao, Liu Heita
jiutangshu/jiutangshu060.txt	jiutangshu/jiutangshu060.html	卷五十六 列傳第六: 蕭銑 杜伏威 輔公祏 沈法興 李子通 羅藝 梁師都 Volume 56 Biographies 6: Xiao Xian, du fuwei, Fu Gongshi, Shen Faxing, Li Zitong, Luo Yi, Liang Shidou
jiutangshu/jiutangshu061.txt	jiutangshu/jiutangshu061.html	卷五十七 列傳第七: 裴寂 劉文靜 Volume 57 Biographies 7: Pei Ji, Liu Wenjing
jiutangshu/jiutangshu062.txt	jiutangshu/jiutangshu062.html	卷五十八 列傳第八: 唐儉 長孫順德 劉弘基 殷嶠 劉政會 柴紹 武士彠 Volume 58 Biographies 8: Tang Jian, Zhangsun Shunde, Liu Hongji, Yin Jiao, Liu Zhenghui, Chai Shao, Wu Shihuo
jiutangshu/jiutangshu063.txt	jiutangshu/jiutangshu063.html	卷五十九 列傳第九: 屈突通 任瓌 丘和 許紹 李襲志 姜謩 Volume 59 Biographies 9: Qu Tutong, Ren Gui, Qiu He, Xu Shao, Li Xizhi, Jian Mo
jiutangshu/jiutangshu064.txt	jiutangshu/jiutangshu064.html	卷六十  列傳第十: 宗室 (太祖諸子 代祖諸子) Volume 60 Biographies 10: Members of the Imperial Family (All Descendents of Taizu and Daizu)
jiutangshu/jiutangshu065.txt	jiutangshu/jiutangshu065.html	卷六十一 列傳第十一: 溫大雅 陳叔達 竇威 Volume 61 Biographies 11: Wen Daya, Chen Shuda, Dou Wei
jiutangshu/jiutangshu066.txt	jiutangshu/jiutangshu066.html	卷六十二 列傳第十二: 李綱 鄭善果 楊恭仁 皇甫無逸 李大亮 Volume 62 Biographies 12: Li Gang, Zheng Shanguo, Yang Gongren, Huangfu Wuyi, Li Daliang
jiutangshu/jiutangshu067.txt	jiutangshu/jiutangshu067.html	卷六十三 列傳第十三: 封倫 蕭瑀 裴矩 宇文士及 Volume 63 Biographies 13: Feng Lun, Xiao Yu, Pei Ju, Yuwen Shiji
jiutangshu/jiutangshu068.txt	jiutangshu/jiutangshu068.html	卷六十四 列傳第十四: 高祖二十二子 Volume 64 Biographies 14: Gaozu's Twenty Two Sons
jiutangshu/jiutangshu069.txt	jiutangshu/jiutangshu069.html	卷六十五 列傳第十五: 高士廉 長孫無忌 Volume 65 Biographies 15: Gao Shilian, Zhangsun Wuji
jiutangshu/jiutangshu070.txt	jiutangshu/jiutangshu070.html	卷六十六 列傳第十六: 房玄齡 杜如晦 Volume 66 Biographies 16: Fang Xuanling, Du Ruhui
jiutangshu/jiutangshu071.txt	jiutangshu/jiutangshu071.html	卷六十七 列傳第十七: 李靖 李勣 Volume 67 Biographies 17: Li Jing, Li Ji
jiutangshu/jiutangshu072.txt	jiutangshu/jiutangshu072.html	卷六十八 列傳第十八: 尉遲敬德 秦叔寶 程知節 段志玄 張公謹 Volume 68 Biographies 18: Weichi Jingde,  Qin Shubao, Cheng Zhijie, Duan Zhixuan, Zheng Gongjin
jiutangshu/jiutangshu073.txt	jiutangshu/jiutangshu073.html	卷六十九 列傳第十九: 侯君集 張亮 薛萬徹 Volume 69 Biographies 19: Hou Junji, Zhang Liang, Xue Wanche
jiutangshu/jiutangshu074.txt	jiutangshu/jiutangshu074.html	卷七十  列傳第二十: 王珪 戴冑 岑文本 杜正倫 Volume 70 Biographies 20: Wang Gui, Dai Zhou, Cen Wenben, Du Zhenglun
jiutangshu/jiutangshu075.txt	jiutangshu/jiutangshu075.html	卷七十一 列傳第二十一: 魏徵 Volume 71 Biographies 21: Wei Zheng
jiutangshu/jiutangshu076.txt	jiutangshu/jiutangshu076.html	卷七十二 列傳第二十二: 虞世南 李百藥 褚亮 Volume 72 Biographies 22: Yu Shinian, Li Baiyao, Chuliang
jiutangshu/jiutangshu077.txt	jiutangshu/jiutangshu077.html	卷七十三 列傳第二十三: 薛收 姚思廉 顏師古 令狐德棻 孔穎達 Volume 73 Biographies 23: Xue Shou, Yao Silian, Yan Shigu, Linghu Defen, Kong Yingda
jiutangshu/jiutangshu078.txt	jiutangshu/jiutangshu078.html	卷七十四 列傳第二十四: 劉洎 馬周 崔仁師 Volume 74 Biographies 24: Liu Ji, Ma Zhou, Cui Renshi
jiutangshu/jiutangshu079.txt	jiutangshu/jiutangshu079.html	卷七十五 列傳第二十五: 蘇世長 韋雲起 孫伏伽 張玄素 Volume 75 Biographies 25: Su Shizhang, Wei Yunqi, Sun Fujia, Zhang Xuansu
jiutangshu/jiutangshu080.txt	jiutangshu/jiutangshu080.html	卷七十六 列傳第二十六: 太宗諸子 Volume 76 Biographies 26: Taizong's Sons
jiutangshu/jiutangshu081.txt	jiutangshu/jiutangshu081.html	卷七十七 列傳第二十七: 韋挺 楊纂 劉德威 閻立德 柳亨 崔義玄 Volume 77 Biographies 27: Wei Ting, Yang Zuan, Liu Dewei, Yan Lide, Liu Heng, Cui Yixuan
jiutangshu/jiutangshu082.txt	jiutangshu/jiutangshu082.html	卷七十八 列傳第二十八: 于志寧 高季輔 張行成 Volume 78 Biographies 28:  Yu Zhining, Gao Jifu, Zhang Xingcheng
jiutangshu/jiutangshu083.txt	jiutangshu/jiutangshu083.html	卷七十九 列傳第二十九: 祖孝孫 傅仁均 傅奕 李淳風 呂才 Volume 79 Biographies 29: Zu Xiaosun, Fu Renjun, Fu Yi, Li Chunfeng, Lucai
jiutangshu/jiutangshu084.txt	jiutangshu/jiutangshu084.html	卷八十  列傳第三十: 褚遂良 韓瑗 來濟 上官儀 Volume 80 Biographies 30:  Chu Suiliang, Han Yuan, Lai Ji, Shang Guanyi
jiutangshu/jiutangshu085.txt	jiutangshu/jiutangshu085.html	卷八十一 列傳第三十一: 崔敦禮 盧承慶 劉祥道 李敬玄 李義琰 孫處約 樂彥瑋 趙仁本 Volume 81 Biographies 31: Cui dunli, Lu Chengqin, Liu Xiangdao, Li Jingxuan, Li Yiyan, Sun Chuyue, Le Yanwei, Zhao Renben
jiutangshu/jiutangshu086.txt	jiutangshu/jiutangshu086.html	卷八十二 列傳第三十二: 許敬宗 李義府 Volume 82 Biographies 32: Xu Jingzong, Li Yifu
jiutangshu/jiutangshu087.txt	jiutangshu/jiutangshu087.html	卷八十三 列傳第三十三: 郭孝恪 張儉 蘇定方 薛仁貴 程務挺 張士貴 趙道興 Volume 83 Biographies 33: Guo Xiaoke, Zhang Jian, Su Dingfang, Xue Rengui, Cheng Wuting, Zhang Shigui, Zhao Daoxing
jiutangshu/jiutangshu088.txt	jiutangshu/jiutangshu088.html	卷八十四 列傳第三十四: 劉仁軌 郝處俊 裴行儉 Volume 84 Biographies 34: Liu Rengui, Hao Chujun, Pei Xingjian
jiutangshu/jiutangshu089.txt	jiutangshu/jiutangshu089.html	卷八十五 列傳第三十五: 唐臨 張文瓘 徐有功 Volume 85 Biographies 35: Tang Lin, Zhang Wenguan, Xu Yougong
jiutangshu/jiutangshu090.txt	jiutangshu/jiutangshu090.html	卷八十六 列傳第三十六: 高宗中宗諸子 Volume 86 Biographies 36: Gaozong's and Zhongzong's Sons
jiutangshu/jiutangshu091.txt	jiutangshu/jiutangshu091.html	卷八十七 列傳第三十七: 裴炎 劉禕之 魏玄同 李昭德 Volume 87 Biographies 37: Pei Yan, Liu Yizhi, Wei Xuantong, Li Zhaode
jiutangshu/jiutangshu092.txt	jiutangshu/jiutangshu092.html	卷八十八 列傳第三十八: 韋思謙 陸元方 蘇瑰 Volume 88 Biographies 38: Wei Siqian, Lu Yuanfang, Su Gui
jiutangshu/jiutangshu093.txt	jiutangshu/jiutangshu093.html	卷八十九 列傳第三十九: 狄仁傑 王方慶 姚璹 Volume 89 Biographies 39: Di Renjie, Wang Fangqing, Yao Shu
jiutangshu/jiutangshu094.txt	jiutangshu/jiutangshu094.html	卷九十  列傳第四十: 王及善 杜景儉 朱敬則 楊再思 李懷遠 豆盧欽望 Volume 90 Biographies 40: Wang Jishan, Du Jingjian, Zhu Jingze, Yang Zaisi, Li Huaiyuan, Doulu Qinwang
jiutangshu/jiutangshu095.txt	jiutangshu/jiutangshu095.html	卷九十一 列傳第四十一: 桓彥範 敬暉 崔玄暐 張柬之 袁恕己 Volume 91 Biographies 41: Huan Yanfan, Jing Hui, Cui Xuanwei, Zhang Jianzhi, Yuan Shuji
jiutangshu/jiutangshu096.txt	jiutangshu/jiutangshu096.html	卷九十二 列傳第四十二: 魏元忠 韋安石 蕭至忠 宗楚客 紀處訥 Volume 92 Biographies 42: Wei Yuanzhong, Wei Anshi, Ziao Zhizhong, Zong Chuke, Ji Chune
jiutangshu/jiutangshu097.txt	jiutangshu/jiutangshu097.html	卷九十三 列傳第四十三: 婁師德 王孝傑 唐休璟 張仁願 薛訥 王晙 Volume 93 Biographies 43: Lou Shide, Wang Xiaojie, Tang Xiujing, Zhang Renyuan, Xue Ne, Wang Jun
jiutangshu/jiutangshu098.txt	jiutangshu/jiutangshu098.html	卷九十四 列傳第四十四: 蘇味道 李嶠 崔融 盧藏用 徐彥伯 Volume 94 Biographies 44: Su Weidao, Li Jiao, Cui Rong, Lu Cangyong, Xu Yanbo
jiutangshu/jiutangshu099.txt	jiutangshu/jiutangshu099.html	卷九十五 列傳第四十五: 睿宗諸子 Volume 95 Biographies 45: Ruizong's Sons
jiutangshu/jiutangshu100.txt	jiutangshu/jiutangshu100.html	卷九十六 列傳第四十六: 姚崇 宋璟 Volume 96 Biographies 46: Yao Chong, Song Jing
jiutangshu/jiutangshu101.txt	jiutangshu/jiutangshu101.html	卷九十七 列傳第四十七: 劉幽求 鐘紹京 郭元振 張說 Volume 97 Biographies 47: Liu Youqiu, Zhong Shaojing, Guo Yuanzhen, Zhang Shuo
jiutangshu/jiutangshu102.txt	jiutangshu/jiutangshu102.html	卷九十八 列傳第四十八: 魏知古 盧懷慎 源乾曜 李元纮 杜暹 韓休 裴耀卿 Volume 98 Biographies 48: Wei Zhigu, Lu Huaishen, Yuan Ganyao, Li Yuanhong, Du Xian, Han Xiu, Pei Yaoqing
jiutangshu/jiutangshu103.txt	jiutangshu/jiutangshu103.html	卷九十九 列傳第四十九: 崔日用 張嘉貞 蕭嵩 張九齡 李適之 嚴挺之 Volume 99 Biographies 49: Cui Riyong, Zhang Jiazhen, Xiao Song, Zhang Jiuling, Li Shizhi, Yan Tingzhi
jiutangshu/jiutangshu104.txt	jiutangshu/jiutangshu104.html	卷一百  列傳第五十: 尹思貞 李傑 解琬 畢構 蘇珦 鄭惟忠 王志愔 盧從願 李朝隱 裴漼 王丘 Volume 100 Biographies 50: Yin Sizhen, Li Jie, Jie Wan, Bi Gou, Su Xiang, Zheng Weizhong, Wang Zhiyin, Lu Congyuan, Li Chaoyin, Pei Cui, Wang Qiu
jiutangshu/jiutangshu105.txt	jiutangshu/jiutangshu105.html	卷一百〇一 列傳第五十一: 李乂 薛登 韋湊 韓思復 張廷珪 王求禮 辛替否 Volume 101 Biographies 51: Li Yi, Xue Deng, Wei Cou,  Han Sifu, Zhang Tinggui, Wang Qiuli, Xin Tifou
jiutangshu/jiutangshu106.txt	jiutangshu/jiutangshu106.html	卷一百〇二 列傳第五十二: 馬懷素 褚無量 劉子玄 徐堅 元行沖 吳兢 韋述 Volume 102 Biographies 52: Ma Huaisu, Chu Wuliang, Liu Zixuan, Xu Jian, Yuan Xingchong, Wu Jing, Wei Shu
jiutangshu/jiutangshu107.txt	jiutangshu/jiutangshu107.html	卷一百〇三 列傳第五十三: 郭虔瓘 張嵩 郭知運 王君 張守珪 牛仙客 王忠嗣 Volume 103 Biographies 53: Guo Qianguan, Zhang Song, Guo Zhiyun, Wang Jun, Zhang Shougui, Niu Xianke, Wang Zhongsi
jiutangshu/jiutangshu108.txt	jiutangshu/jiutangshu108.html	卷一百〇四 列傳第五十四: 高仙芝 封常清 哥舒翰 Volume 104 Biographies 54: Gao Xianzhi, Feng Changqing, Ge Shuhan
jiutangshu/jiutangshu109.txt	jiutangshu/jiutangshu109.html	卷一百〇五 列傳第五十五: 宇文融 韋堅 楊慎矜 王鉷 Volume 105 Biographies 55: Yu Wenrong, Wei Jian, Yang Shenjin, Wang Hong
jiutangshu/jiutangshu110.txt	jiutangshu/jiutangshu110.html	卷一百〇六 列傳第五十六: 李林甫 楊國忠 張暐 王琚 王毛仲 陳玄禮 Volume 106 Biographies 56: Li Linfu, Yang Guozhong, Zhang Wei, Wang Ju, Wang Maozhong, Chen Xuanli
jiutangshu/jiutangshu111.txt	jiutangshu/jiutangshu111.html	卷一百〇七 列傳第五十七: 玄宗諸子 Volume 111 Biographies 57: Xuanzong's Sons
jiutangshu/jiutangshu112.txt	jiutangshu/jiutangshu112.html	卷一百〇八 列傳第五十八: 韋見素 崔圓 崔渙 杜鴻漸 Volume 108 Biographies 58: Wei Jiansu, Cui Yuan, Cui Huan, Du Hongjian
jiutangshu/jiutangshu113.txt	jiutangshu/jiutangshu113.html	卷一百〇九 列傳第五十九: 馮盎 阿史那社爾 契苾何力 黑齒常之 李多祚 李嗣業 白孝德 Volume 109 Biographies 59: Feng Gang, Ashinashe'er, Qibi Heli, Heichi Changzhi, Li Duozuo, Li Siye, Bai Xiaode
jiutangshu/jiutangshu114.txt	jiutangshu/jiutangshu114.html	卷一百一十 列傳第六十: 李光弼 王思禮 鄧景山 辛雲京 Volume 110 Biographies 60: Li Guangbi, Wang Sili, Deng Jingshan, Xin Yunjing
jiutangshu/jiutangshu115.txt	jiutangshu/jiutangshu115.html	卷一百十一 列傳第六十一: 崔光遠 房琯 張鎬 高適 暢璀 Volume 111 Biographies 61: Cui Guan Yuan, Fang Guan, Zhang Gao, Gao Shi, Chang Cui
jiutangshu/jiutangshu116.txt	jiutangshu/jiutangshu116.html	卷一百十二 列傳第六十二: 李暠 李麟 李國貞 李峘 李巨 Volume 112 Biographies 62: Li Gao, Li Lin, Li Guozhen, Li Huan, Li Ju
jiutangshu/jiutangshu117.txt	jiutangshu/jiutangshu117.html	卷一百十三 列傳第六十三: 苗晉卿 裴冕 裴遵慶 Volume 113 Biographies 63: Miao Jingqing, Pei Mian, Pei Zunqing
jiutangshu/jiutangshu118.txt	jiutangshu/jiutangshu118.html	卷一百十四 列傳第六十四: 魯炅 裴茙 來瑱 周智光 Volume 114 Biographies 64: Lu Jiong, Pei Rong,  Lai Zhen, Zhou Zhiguan
jiutangshu/jiutangshu119.txt	jiutangshu/jiutangshu119.html	卷一百十五 列傳第六十五: 崔器 趙國珍 崔瓘 敬括 韋元甫 魏少游 衛伯玉 李承 Volume 115 Biographies 65: Cui Qi, Zhao Guozhen, Cui Guan, Jing Kuo, Wei Yuanfu, Wei Shaoyou, Wei Boyu, Li Cheng
jiutangshu/jiutangshu120.txt	jiutangshu/jiutangshu120.html	卷一百十六 列傳第六十六: 肅宗代宗諸子 Volume 116 Biographies 66: Suzong and Daizong's Sons
jiutangshu/jiutangshu121.txt	jiutangshu/jiutangshu121.html	卷一百十七 列傳第六十七: 嚴武 郭英乂 崔寧 嚴震 嚴礪 Volume 117 Biographies 67: Yan Wu,  Guo Yingyi, Cui Ning, Yan Zhen, Yan Li
jiutangshu/jiutangshu122.txt	jiutangshu/jiutangshu122.html	卷一百十八 列傳第六十八: 元載 王昂 李少良 王縉 楊炎 黎幹 庾準 Volume 118 Biographies 68: Yuan Zai, Wan Gang, Li Shaoliang, Wang Jin, Yang Yan, Li Gan, Yu Zhun
jiutangshu/jiutangshu123.txt	jiutangshu/jiutangshu123.html	卷一百十九 列傳第六十九: 楊綰 崔祐甫 常袞 Volume 119 Biographies 69: Yang Wan,  Cui Youfu, Chang Gun
jiutangshu/jiutangshu124.txt	jiutangshu/jiutangshu124.html	卷一百二十  列傳第七十: 郭子儀 Volume 120 Biographies 70: Guo Ziyi
jiutangshu/jiutangshu125.txt	jiutangshu/jiutangshu125.html	卷一百二十一 列傳第七十一: 僕固懷恩 梁崇義 李懷光 Volume 121 Biographies 71: Pugu Huai'en, Liang Chongyi, Li Huaiguan
jiutangshu/jiutangshu126.txt	jiutangshu/jiutangshu126.html	卷一百二十二 列傳第七十二: 張獻誠 路嗣恭 曲環 進漢衡 楊朝晟 樊澤 李叔明 裴冑 Volume 122 Biographies 72: Zhang Xiancheng, Lu Sigong,Qu Huan, Jin Hanheng, Yang Chaocheng, Fan Ze, Li Shuming, Pei Zhou
jiutangshu/jiutangshu127.txt	jiutangshu/jiutangshu127.html	卷一百二十三 列傳第七十三: 劉晏 第五琦 班宏 班紹 李巽 Volume 123 Biographies 73: Liu Yan, Di Wuqi, Ban Hong, Ban Shao, Li Xun
jiutangshu/jiutangshu128.txt	jiutangshu/jiutangshu128.html	卷一百二十四 列傳第七十四: 薛嵩 令狐彰 田神功 侯希逸 李正己 Volume 124 Biographies 74: Xue Song, Ling Huzhuang, Tian Shengong, Hou Xiyi, Li Zhengji
jiutangshu/jiutangshu129.txt	jiutangshu/jiutangshu129.html	卷一百二十五 列傳第七十五: 張鎰 劉從一 蕭復 柳渾 Volume 125 Biographies 75: Zhang Yi, Liu Congyi, Xiao Fu, Liu Hun
jiutangshu/jiutangshu130.txt	jiutangshu/jiutangshu130.html	卷一百二十六 列傳第七十六: 李揆 李涵 陳少游 盧鸑 裴諝 Volume 126 Biographies 76: Li Kui,  Li Han,  Chen Shaoyou,  Lu Yue,  Pei Xu
jiutangshu/jiutangshu131.txt	jiutangshu/jiutangshu131.html	卷一百二十七 列傳第七十七: 姚令言 張光晟 源休 喬琳 張涉 蔣鎮 洪經綸 彭偃 Volume 127 Biographies 77: Yao Lingyan,  Zhang Guangcheng,  Yuan Xiu,  Qiao Lin,  Zhang She,  Jiang Zhen,  Hong Jinglun,  Peng Yan
jiutangshu/jiutangshu132.txt	jiutangshu/jiutangshu132.html	卷一百二十八 列傳第七十八: 段秀實 顏真卿 Volume 128 Biographies 78: Duan Xiushi,  Yan Zhenqing
jiutangshu/jiutangshu133.txt	jiutangshu/jiutangshu133.html	卷一百二十九 列傳第七十九: 韓滉 張延賞 Volume 129 Biographies 79: Han Huang,  Zhang Yanshang
jiutangshu/jiutangshu134.txt	jiutangshu/jiutangshu134.html	卷一百三十  列傳第八十: 王璵 李泌 崔造 關播 Volume 130 Biographies 80: Wang Yu,  Li Bi,  Cui Zao,  Guan Bo
jiutangshu/jiutangshu135.txt	jiutangshu/jiutangshu135.html	卷一百三十一 列傳第八十一: 李勉 李皋 子像古 道古 Volume 131 Biographies 81: Li Mian,  Li Gao,  Zi Xianggu,  Dao Gu
jiutangshu/jiutangshu136.txt	jiutangshu/jiutangshu136.html	卷一百三十二 列傳第八十二: 李抱玉 李抱真 王虔休 盧從史 李芃 李澄 Volume 132 Biographies 82: Li Baoyu,  Li Baozhen,  Wang Qianxiu,  Lu Congshi,  Li Peng,  Li Cheng
jiutangshu/jiutangshu137.txt	jiutangshu/jiutangshu137.html	卷一百三十三 列傳第八十三: 李晟 Volume 133 Biographies 83: Li Cheng
jiutangshu/jiutangshu138.txt	jiutangshu/jiutangshu138.html	卷一百三十四 列傳第八十四: 馬燧 渾瑊 Volume 134 Biographies 84: Ma Sui,  Hun Jian
jiutangshu/jiutangshu139.txt	jiutangshu/jiutangshu139.html	卷一百三十五 列傳第八十五: 盧杞 白志貞 裴延齡 韋渠牟 李齊運 李實 韋執誼 王叔文 程異 皇甫抃 Volume 135 Biographies 85: Lu Qi, Bai Zhizhen, Pei Yanling, Wei Qumou,  Li Qiyun, Li Shi, Wei Zhiyi, Wang Shuwen,  Cheng Yi, Huang Fubian
jiutangshu/jiutangshu140.txt	jiutangshu/jiutangshu140.html	卷一百三十六 列傳第八十六: 竇參 齊映 劉滋 盧邁 崔損 齊抗 Volume 135 Biographies 86: Dou Can,  Qi Ying,  Liu Zi, Li Mai,  Cui Sun, Qi Kang
jiutangshu/jiutangshu141.txt	jiutangshu/jiutangshu141.html	卷一百三十七 列傳第八十七: 徐浩 趙涓 劉太真 李紓 邵說 于邵 崔元翰 于公異 呂渭 鄭雲逵 李益 李賀 Volume 137 Biographies 87: Xu Hao,  Zhao Juan, Liu Taizhen,  Li Shu,  Shao Shuo,  Yu Shao,  Cui Yuanhan, Yu Gongyi, Lu Wei, Zheng Yunkui, Li Yi, Li He
jiutangshu/jiutangshu142.txt	jiutangshu/jiutangshu142.html	卷一百三十八 列傳第八十八: 趙憬 韋倫 賈耽 姜公輔 Volume 138 Biographies 88: Zhao Jing,  Wei Lun,  Jia Dan,  Jiang Gongfu
jiutangshu/jiutangshu143.txt	jiutangshu/jiutangshu143.html	卷一百三十九 列傳第八十九: 陸贄 Volume 139 Biographies 89: Lu Zhi
jiutangshu/jiutangshu144.txt	jiutangshu/jiutangshu144.html	卷一百四十  列傳第九十: 韋皋 張建封 盧群 Volume 140 Biographies 90: Wei Gao,  Zhang Jianfeng,  Lu Qun
jiutangshu/jiutangshu145.txt	jiutangshu/jiutangshu145.html	卷一百四十一 列傳第九十一: 田承嗣 田弘正 張孝忠 Volume 141 Biographies 91: Tian Chengsi, Tian Hongzhen, Zhang Xiaozhong
